{"analysis_id":"analysis-3d9c3279cdf39c32edc38c32","blockers":[],"classification":{"category":"real_test_gap","confidence":0.93,"evidence_ids":["mutant:209e93bc414d","selection:77bad1fd0c22","context:b44881e3b978"],"reason":"Execution is valid and the mutant changes reachable behavior, but the current tests do not detect it.","secondary_categories":[]},"confidence":0.93,"findings":[{"description":"The mutant changes an observed behavior, yet no selected test failed on it.","evidence_ids":["mutant:209e93bc414d","selection:77bad1fd0c22","context:b44881e3b978"],"finding_id":"finding:0e093f93291b","kind":"real_test_gap","severity":"info","title":"Reachable behavior changed without a kill"}],"hypotheses":[{"confidence":0.9,"evidence_ids":["mutant:209e93bc414d","selection:77bad1fd0c22","context:b44881e3b978"],"explanation":"The mutation changes a comparison outcome. Use values immediately below, at, and immediately above the boundary.","hypothesis_id":"hyp-2a1ba86c02f44cc4","kind":"boundary_input","related_tests":[],"suggested_assertions":["assert the exact branch or returned value","assert the boundary and neighboring cases separately"],"suggested_inputs":["2","3","4"],"target_behavior":"The branch and returned behavior must change at the exact comparison boundary.","title":"Exercise the comparison boundary"}],"proposal_set_id":"proposal-set-01eceef739a244e353cd890e","proposals":[{"action":["The branch and returned behavior must change at the exact comparison boundary."],"arrangement":["2","3","4"],"assertions":["assert the exact branch or returned value","assert the boundary and neighboring cases separately"],"expected_mutant_outcome":"Candidate test fails on the target mutant.","expected_original_outcome":"Candidate test passes on the original source.","fixtures_needed":["project-specific fixture for the mutated function"],"generated_code":"def test_survivor_boundary_input_m_example_001():\n    # Candidate only; fill project-specific fixtures and imports.\n    # Arrange: 2\n    # Assert: assert the exact branch or returned value\n    raise NotImplementedError","generation_source":"deterministic_template","imports_needed":[],"proposal_id":"proposal-62fd815424311683","proposed_test_name":"test_survivor_boundary_input_m_example_001","rationale":"The mutation changes a comparison outcome. Use values immediately below, at, and immediately above the boundary.","target_test_file":null,"target_test_nodeid":null}],"provider":{"deterministic":true,"invoked":true,"name":"deterministic-template","request_sha256":"1c0be60eec07558b29a1bc22e2aa790fe2297df0522347f96b647f4f10256bde","response_sha256":"faee123faab46efc5661f1324e4e129ac5c9f3c8521d622a6c6a3d2b8f49193c","version":"1"},"request_id":"example-real-gap","result_id":"result-74a846797ae3731ef64fea6b","schema_version":1,"validation_plan":{"mutant_checks":[{"command_hint":"pytest <candidate-nodeid>","purpose":"Confirm the candidate distinguishes the target mutant.","step_id":"mutant-kill","title":"Candidate fails on target mutant"}],"original_checks":[{"command_hint":"pytest <candidate-nodeid>","purpose":"Confirm candidate correctness on original source.","step_id":"original-pass","title":"Candidate passes on original"}],"regression_checks":[{"command_hint":"pytest <related-tests>","purpose":"Prevent an unrelated regression in connected behavior.","step_id":"related-green","title":"Related tests remain green"}],"stability_checks":[{"command_hint":"pytest <candidate-nodeid> --count=<n>","purpose":"Detect flaky or timing-only assertions.","step_id":"repeat-original","title":"Repeat original candidate"},{"command_hint":"review candidate fixture paths","purpose":"Ensure the candidate does not depend on a temporary absolute path.","step_id":"workspace-independent","title":"Check workspace independence"},{"command_hint":"review candidate assertions","purpose":"Ensure success is based on behavior rather than timing alone.","step_id":"no-timing-only","title":"Check assertion stability"}]},"warnings":[]}
